{
    "num_nodes": 1,
    "link_bw": 32,
    "link_latency": 0,
    "nodes": [
        {
            "num_instances": 1,
            "cpu_mem": {
                "mem_size": 128,
                "mem_bw": 256,
                "mem_latency": 0
            },
            "instances": [
                {
                    "model_name": "meta-llama/Llama-3.1-8B",
                    "hardware": "A5000",
                    "npu_mem": {
                        "mem_size": 24,
                        "mem_bw": 768,
                        "mem_latency": 0
                    },
                    "npu_num": 2,
                    "npu_group": 1,
                    "pd_type": null
                }
            ],
            "power": {
                "base_node_power": 60,
                "npu": {
                    "A5000": {
                        "idle_power": 18,
                        "standby_power": 20,
                        "active_power": 130,
                        "standby_duration": 18
                    }
                },
                "cpu": {
                    "idle_power": 10,
                    "active_power": 150,
                    "util": 0.15
                },
                "dram": {
                    "dimm_size": 32,
                    "idle_power": 2.0,
                    "energy_per_bit": 6.0
                },
                "link": {
                    "num_links": 2,
                    "idle_power": 5,
                    "energy_per_bit": 4.0
                },
                "nic": {
                    "num_nics": 1,
                    "idle_power": 20
                },
                "storage": {
                    "num_devices": 2,
                    "idle_power": 5
                }
            }
        }
    ]
}
